{
  "case_id": "manual_min_jian_guan_san_francisco_ca",
  "case_title": "Min Jian Guan",
  "artifact_id": "artifact_001",
  "artifact_type": "bodycam",
  "source_url": "https://www.youtube.com/watch?v=ytap7WQnLK4",
  "source_authority": "third_party",
  "downloadable": true,
  "format": "video",
  "duration_sec": null,
  "requires_manual_download": false,
  "confidence": 0.81,
  "matched_case_fields": ["defendant_full_name"]
}
